Unnamed: 0,ID,Name,Alias,Gender,Hair Color,Love Rank,Hate Rank,Eye color,Birthday,Blood Type,Tags,Love Count,Hate Count,Description,url,Counts,MAL_ID
8527,8528,Baki HANMA,Unknown,Male,Brown,7.567,26.789,Unknown,Unknown,Unknown,"Martial Artists, Muscular, Teenagers",298,12,Unknown,https://www.anime-planet.com/characters/baki-hanma,310.0,34443.0
29764,29766,Shirasu KINJOU,Unknown,Male,White,8.519,9.192,Unknown,Unknown,Unknown,"Adults, Headbands, Ninja",257,53,Unknown,https://www.anime-planet.com/characters/shirasu-kinjou,310.0,
25707,25709,Rico FLAMEL,Unknown,Female,Blue,8.484,9.343,Unknown,Unknown,Unknown,"Big Ego, Gunslingers, Teenagers",258,52,Unknown,https://www.anime-planet.com/characters/rico-flamel,310.0,
7610,7611,Gozaburo KAIBA,Unknown,Male,Grey,41.199,1.656,Unknown,Unknown,Unknown,"Adults, Board Game Players, Facial Hair, Ruthless, Selfish, Wealthy",22,287,Unknown,https://www.anime-planet.com/characters/gozaburo-kaiba,309.0,
127176,127205,Issei MIYATA,Gum Boy,Male,Blonde,7.562,30.541,Black,Unknown,Unknown,"High School Students, Teenagers, Sweet Tooth",299,10,Unknown,https://www.anime-planet.com/characters/issei-miyata,309.0,
6967,6968,Yukie SAKAMOTO,Unknown,Female,Black,65.058,1.576,Unknown,Unknown,Unknown,Adults,8,301,Unknown,https://www.anime-planet.com/characters/yukie-sakamoto,309.0,14345.0
11996,11998,Chousuke TAKADA,Unknown,Male,Black,47.255,1.633,Unknown,Unknown,Unknown,"Cruel, Teenagers, Middle School Students, Glasses, Bullies",17,292,Unknown,https://www.anime-planet.com/characters/chousuke-takada,309.0,
30188,30190,Homily,Unknown,Female,Black,8.586,8.881,Unknown,Unknown,Unknown,"Adults, Ponytail, Tiny People",254,55,Unknown,https://www.anime-planet.com/characters/homily,309.0,
7144,7145,Iason MINK,Unknown,Male,Blonde,8.141,12.154,Unknown,Unknown,Unknown,"Gloves, Wealthy, Seme, Piercings, Adults, Manipulative, Genetically Engineered, LGBT+",272,37,Unknown,https://www.anime-planet.com/characters/iason-mink,309.0,719.0
9120,9121,Yui YAMADA,Unknown,Female,Blonde,7.396,70.431,Unknown,Unknown,Unknown,"Teenagers, Lesbians, High School Students, Gardeners, LGBT+",307,2,Unknown,https://www.anime-planet.com/characters/yui-yamada,309.0,
22936,22938,Sarah ADIEMUS,Unknown,Female,Blonde,7.719,20.154,Unknown,Unknown,Unknown,"High School Students, Teenagers",291,18,Unknown,https://www.anime-planet.com/characters/sarah-adiemus,309.0,24.0
37472,37474,Pesci,Unknown,Male,Green,13.829,2.99,Unknown,Unknown,Unknown,"Assassins, Gangsters",137,172,Unknown,https://www.anime-planet.com/characters/pesci,309.0,
13368,13370,Paul VON OBERSTEIN,Unknown,Male,Brown,8.413,9.697,Unknown,May 5,Unknown,"Adults, Analytical, Manipulative, Military, Nobility, Stoic",260,49,"Always calm and cool, Oberstein is cynical, Machiavellian, and very intelligent. He gained Reinhard von Lohengramm's trust after offering to be an advisor, and after proving the worth of his insights and plans, later became his Chief of Staff.",https://www.anime-planet.com/characters/paul-von-oberstein,309.0,
7103,7104,Aika TSUBE,Tail Blue,Female,Blue,7.592,26.718,Unknown,Unknown,Unknown,"High School Students, Pigtails, Teenagers, Hair Ribbons",297,12,Unknown,https://www.anime-planet.com/characters/aika-tsube,309.0,
20216,20218,Valkyrie,Unknown,Female,Multicolored,7.599,27.239,Unknown,Unknown,Unknown,"Scantily-clad, Perverted, Deities, Piercings, Gloves",297,12,Unknown,https://www.anime-planet.com/characters/valkyrie-cautious-hero-the-hero-is-overpowered-but-overly-cautious,309.0,
3483,3483,Kouyuu RI,Unknown,Male,Grey,7.424,47.726,Unknown,Unknown,Unknown,"Politicians, No Sense of Direction",305,4,Unknown,https://www.anime-planet.com/characters/kouyuu-ri,309.0,
5577,5578,Yoko MORINOMIYA,Chairwoman,Female,Grey,7.617,25.66,Unknown,Unknown,Unknown,"Anti-Gravity Hair, Canes, Elderly, Hot-Headed, Overweight",296,13,Unknown,https://www.anime-planet.com/characters/yoko-morinomiya,309.0,
23633,23635,Claudette VANCE,Unknown,Female,Pink,8.532,9.113,Unknown,Unknown,Unknown,Unknown,256,53,Unknown,https://www.anime-planet.com/characters/claudette-vance,309.0,10924.0
23186,23188,Papika,Pure Barrier,Female,Orange,7.492,37.348,Unknown,Unknown,Unknown,"Hair Antenna, Hyperactive, Magical Girl, Rosy Cheeks, Teenagers",302,7,Unknown,https://www.anime-planet.com/characters/papika,309.0,
7429,7430,Deshiko DESHI,Unknown,Female,Red,10.674,4.517,Unknown,Unknown,Unknown,"Human Guise, Verbal Tic, Teenagers, Monsters, High School Students, Disciplinary Committee",194,115,Unknown,https://www.anime-planet.com/characters/deshiko-deshi,309.0,
13092,13094,Mina AZUKI,Unknown,Female,Brown,8.055,13.224,Unknown,Unknown,Unknown,Unknown,276,33,Unknown,https://www.anime-planet.com/characters/mina-azuki,309.0,7674.0
27884,27886,Noel VERMILLION,Eye of the Azure,Female,Blonde,8.002,14.278,Unknown,Unknown,Unknown,"Amnesia, Gunslingers, Hats, Military",279,30,Unknown,https://www.anime-planet.com/characters/noel-vermillion,309.0,18767.0
11890,11892,Misuzu OOYAMA,Unknown,Female,Grey,8.172,11.911,Unknown,Unknown,Unknown,"Elderly, Landlords",271,38,Unknown,https://www.anime-planet.com/characters/misuzu-ooyama,309.0,
2274,2274,Chitose NANBU,Unknown,Female,Red,8.208,11.401,Unknown,Unknown,Unknown,"High School Students, Teenagers, Exorcists, Nuns",269,40,"Dedicating her life to the Buddhist temple, Chitose spends her days worshipping and cleaning with the rest of the nuns. Although she denies it passionately, she has an enormous crush on Ikkou and becomes extremely jealous if anyone else dares to flirt with him. With a love for horror movies, Chitose is also one of the few people who understands Ikkou's power and will reluctantly flash her breasts at him in a time of need.",https://www.anime-planet.com/characters/chitose-nanbu,309.0,
2197,2197,Tsukasa KIRYUU,Unknown,Female,Brown,7.686,20.867,Unknown,Unknown,Unknown,"Teenagers, Photographers, High School Students, Hair Ribbons, Ponytail",292,17,Unknown,https://www.anime-planet.com/characters/tsukasa-kiryuu,309.0,
4873,4873,Nao SAITOU,Unknown,Female,Purple,7.425,47.923,Unknown,Unknown,Unknown,"Disabled, Children, Deaf",305,4,Unknown,https://www.anime-planet.com/characters/nao-saitou,309.0,
29578,29580,Nadeshiko KINOMOTO,Natasha AVALON,Female,Grey,7.626,23.567,Unknown,Unknown,Unknown,"Wings, Ghosts",295,14,"Nadeshiko was the ideal wife and mother, but died while she was still rather young. She lives on in photographs and her family's memory.",https://www.anime-planet.com/characters/nadeshiko-kinomoto,309.0,232.0
12442,12444,Meier LINK,Unknown,Male,White,7.846,17.017,Unknown,Unknown,Unknown,"Vampires, Piercings, Pointy Ears, Ponytail, Scarves, Hair Ribbons",285,23,Unknown,https://www.anime-planet.com/characters/meier-link,308.0,
2534,2534,Miyabi KAGURAZAKI,Unknown,Female,Purple,8.134,12.336,Unknown,Unknown,Unknown,Adults,272,36,Unknown,https://www.anime-planet.com/characters/miyabi-kagurazaki,308.0,53.0
22314,22316,Archer of Red,"Atalanta, Chaste Huntress",Female,Multicolored,8.406,10.146,Unknown,Unknown,Unknown,"Animal Ears, Archers, Braids, Gloves, Immortal, Magical Familiars, Tails",261,47,Unknown,https://www.anime-planet.com/characters/archer-of-red,308.0,34662.0
2334,2334,Aoba TSUKISHIMA,Unknown,Female,Brown,7.576,27.45,Brown,Unknown,Unknown,"Athletes, Baseball Players, Teenagers, Tomboys",297,11,"Aoba is the third sister of the Tsukishima family. A phenom female pitcher, Aoba is competitive, exhibits tomboy tendencies, and possesses a quick temper, particularly toward Ko Kitamura . She was very close to her sister, Wakaba , and as a child was jealous her and Kou's close friendship.",https://www.anime-planet.com/characters/aoba-tsukishima,308.0,5941.0
4441,4441,Anita KING,Unknown,Female,Pink,7.793,18.188,Green,Unknown,Unknown,"Teenagers, Superpowers, Middle School Students, Hot-Headed",287,21,"A stark contrast to her sisters in that she is hot headed and hates books, 12 year old Anita is a skilled paper user specializing in close quarters combat. Although she doesn't hesitate to speak her mind, she often berates her older sisters for not handling money properly.",https://www.anime-planet.com/characters/anita-king,308.0,
10935,10937,Kye-Sook,Unknown,Male,Black,22.296,2.028,Unknown,Unknown,Unknown,"Adults, Hats",66,242,Unknown,https://www.anime-planet.com/characters/kye-sook,308.0,
4272,4272,Chizuru KAWANAMI,Unknown,Female,Red,8.437,9.739,Unknown,Unknown,Unknown,"Hair Antenna, High School Students, Stoic, Teenagers, Transfer Students",259,49,Unknown,https://www.anime-planet.com/characters/chizuru-kawanami,308.0,
17653,17655,Seraphina,Unknown,Female,Multicolored,7.595,28.577,Unknown,Unknown,Unknown,"High School Students, Superpowers, Teenagers",297,11,Unknown,https://www.anime-planet.com/characters/seraphina,308.0,
10990,10992,Pie,Sardon,Male,Black,10.633,4.584,Unknown,Unknown,Unknown,"Aliens, Pointy Ears",195,113,Unknown,https://www.anime-planet.com/characters/pie,308.0,687.0
8214,8215,Chito,Unknown,Female,Black,7.418,71.374,Unknown,Unknown,Unknown,"Animals, Cats, Magical Familiars",306,2,Unknown,https://www.anime-planet.com/characters/chito-flying-witch,308.0,31376.0
30134,30136,Anubis MA'AT,Unknown,Male,Black,8.481,9.633,Unknown,Unknown,Unknown,"Deities, Mischievous, Dark-skinned",258,50,Unknown,https://www.anime-planet.com/characters/anubis-maat,308.0,21563.0
11588,11590,Amagiri,Unknown,Male,Red,13.271,3.129,Unknown,Unknown,Unknown,"Adults, Superpowers, Overweight",144,164,Unknown,https://www.anime-planet.com/characters/amagiri,308.0,7338.0
10539,10540,Hyouma MUROGA,Unknown,Male,Black,7.848,17.047,Unknown,Unknown,Unknown,"Adults, Disabled, Ninja, Sword Fighters, Blind",285,23,Unknown,https://www.anime-planet.com/characters/hyouma-muroga,308.0,
8368,8369,Hiroto TONOMACHI,Unknown,Male,Black,9.133,7.007,Unknown,Unknown,Unknown,"High School Students, Teenagers",236,72,Unknown,https://www.anime-planet.com/characters/hiroto-tonomachi,308.0,
10906,10908,Takatora FUJIMOTO,Unknown,Male,White,7.912,16.353,Unknown,Unknown,Unknown,Hair Antenna,283,25,Unknown,https://www.anime-planet.com/characters/takatora-fujimoto,308.0,
26345,26347,Aoi FUKASAKU,Unknown,Female,Black,9.677,5.788,Unknown,Unknown,Unknown,"Genetically Engineered, Teenagers",219,89,Unknown,https://www.anime-planet.com/characters/aoi-fukasaku,308.0,9479.0
9269,9270,Izo,Unknown,Male,Black,9.443,6.272,Unknown,October 13,Unknown,"Adults, Crossdressers, Gunslingers, Pirates, Sailors",226,82,"Izo is the commander of Whitebeard ’s sixteenth division. While he may dress up like a geisha, he harbours exceptional powers, particularly when it comes to wielding hand pistols.",https://www.anime-planet.com/characters/izo,308.0,21.0
4406,4406,Tsubasa OZORA,"Field Samurai, Oliver HUTTON, Soccer Genius",Male,Black,7.892,16.059,Unknown,Unknown,Unknown,"Soccer Players, Athletes, Team Captains",283,25,Unknown,https://www.anime-planet.com/characters/tsubasa-ozora,308.0,2116.0
5085,5085,Akira SHIODOME,Unknown,Male,Black,8.104,13.031,Unknown,Unknown,Unknown,Children,274,34,Unknown,https://www.anime-planet.com/characters/akira-shiodome,308.0,
29911,29913,Bevel,Unknown,Male,Brown,7.883,16.745,Unknown,Unknown,Unknown,"Children, Headbands, Rosy Cheeks, Sickly",284,24,Unknown,https://www.anime-planet.com/characters/bevel,308.0,
30597,30599,Yamakatsu,Unknown,Male,Brown,8.61,8.872,Unknown,Unknown,Unknown,"Middle School Students, Teenagers, Dark-skinned",253,55,Unknown,https://www.anime-planet.com/characters/yamakatsu,308.0,6880.0
13209,13211,Chiaki KURIHARA,Unknown,Female,Black,7.763,19.641,Unknown,Unknown,Unknown,"Glasses, High School Students, Space Pirates, Teenagers, Transfer Students",289,19,Unknown,https://www.anime-planet.com/characters/chiaki-kurihara,308.0,
429,429,Akane SHINJOU,Unknown,Female,Purple,8.003,15.155,Pink,"January 2, 2003",A,High School Students,279,28,Unknown,https://www.anime-planet.com/characters/akane-shinjou-ssss-gridman,307.0,35847.0
22170,22172,Lecty EISENACH,Unknown,Female,Blonde,7.862,17.964,Unknown,Unknown,Unknown,"Dual Wielders, Teenagers",285,22,Unknown,https://www.anime-planet.com/characters/lecty-eisenach,307.0,
24615,24617,Izumi SEGAWA,Unknown,Female,Purple,7.671,23.659,Unknown,June 21,A,"High School Students, Student Council, Teenagers, Twins",293,14,Unknown,https://www.anime-planet.com/characters/izumi-segawa,307.0,
11983,11985,Yuriko HORI,Unknown,Female,Brown,7.451,57.469,Brown,Unknown,Unknown,"Adults, Closed Eyes",304,3,Unknown,https://www.anime-planet.com/characters/yuriko-hori,307.0,42897.0
29119,29121,Toshiki MIYAMIZU,Unknown,Male,Brown,40.689,1.679,Unknown,Unknown,Unknown,"Adults, Politicians",23,284,Unknown,https://www.anime-planet.com/characters/toshiki-miyamizu,307.0,
4694,4694,Shuichiro SAWAKI,Unknown,Male,Brown,26.778,1.909,Brown,Unknown,Unknown,"Teachers, Moles, Adults",49,258,Unknown,https://www.anime-planet.com/characters/shuichiro-sawaki,307.0,43299.0
18746,18748,Kirara MIKUMARI,Unknown,Female,Brown,8.946,7.612,Unknown,Unknown,Unknown,"Adults, Shrine Maidens",242,65,Unknown,https://www.anime-planet.com/characters/kirara-samurai-7,307.0,166.0
10352,10353,Yuzu IIZUKA,Unknown,Female,Brown,7.511,40.019,Brown,September 27,Unknown,"High School Students, Teenagers",301,6,Unknown,https://www.anime-planet.com/characters/yuzu-iizuka,307.0,20047.0
10944,10946,Oskar VON REUENTAL,Unknown,Male,Brown,7.516,35.388,Unknown,October 26,Unknown,"Adults, Analytical, Heterochromia, Honorable Fighters, Military, Nobility",300,7,"One of the highest ranking officers in Reinhard von Lohengramm's fleet, Oskar von Reuental continually proves his worth on the battlefield, but sometimes criticizes his superiors in private. He is ambitious and scheming.",https://www.anime-planet.com/characters/oskar-von-reuental,307.0,
26703,26705,Tenzo CLOTHUNIT,Unknown,Male,Blonde,7.565,31.297,Unknown,Unknown,Unknown,"Hats, Masks, Ninja, Scarves, Verbal Tic",298,9,Unknown,https://www.anime-planet.com/characters/tenzo-clothunit,307.0,
12057,12059,O-chan,Unknown,Unknown,White,7.425,66.442,Unknown,Unknown,Unknown,Youkai,305,2,Unknown,https://www.anime-planet.com/characters/o-chan,307.0,
14214,14216,Kouichi's Grandmother,Unknown,Female,Brown,9.447,6.346,Unknown,Unknown,Unknown,Elderly,226,81,Unknown,https://www.anime-planet.com/characters/kouichis-grandmother,307.0,11111.0
18391,18393,Isaac Ray Pelham WESTCOTT,Unknown,Male,White,31.831,1.777,Unknown,Unknown,Unknown,"Adults, Company Presidents, Darkness Powers, Elemental Powers",36,271,Unknown,https://www.anime-planet.com/characters/isaac-ray-pelham-westcott,307.0,
27800,27802,Tejima,Teshima,Male,Brown,17.778,2.329,Unknown,Unknown,Unknown,"Teachers, Adults",94,213,"Tejima-sensei, along with a few other teachers, cares about the school's safety; however, he's also a shining example of 'being in the wrong place at the wrong time.'",https://www.anime-planet.com/characters/tejima-highschool-of-the-dead,307.0,8074.0
8623,8624,Touru NANAMINE,Unknown,Male,Red,23.828,1.988,Unknown,Unknown,Unknown,"Artists, Teenagers, Writers",59,248,Unknown,https://www.anime-planet.com/characters/touru-nanamine,307.0,
7635,7636,Edo PHOENIX,Aster PHOENIX,Male,Grey,8.306,10.978,Unknown,Unknown,Unknown,"Big Ego, Battle Gamers, Teenagers, Wealthy",265,42,Unknown,https://www.anime-planet.com/characters/edo-phoenix,307.0,
27903,27905,Boodle,Unknown,Male,Grey,12.499,3.417,Unknown,January 16,Unknown,"Elderly, Glasses",156,151,"Boodle is the Mayor of Port Town. Though he doesn’t have immense strength, he is very brave when it comes to protecting his town from Buggy ’s crew.",https://www.anime-planet.com/characters/boodle,307.0,21.0
28076,28078,Kamakiri,Unknown,Male,Brown,10.639,4.673,Unknown,July 10,Unknown,"Adults, Lancers, Mohawks, Piercings, Scantily-clad, Sunglasses, Warriors, Wings",195,111,"Kamakiri is one of Wiper ’s most trusted and strongest warriors. He generally remains calmer than the others and is kinder, particularly towards Aisa and Raki .",https://www.anime-planet.com/characters/kamakiri,306.0,21.0
21858,21860,Miou OOTORI,Unknown,Female,Purple,7.55,36.824,Unknown,Unknown,Unknown,"Dual Wielders, Gunslingers, High School Students, Rosy Cheeks, Teenagers, Wealthy",299,7,Unknown,https://www.anime-planet.com/characters/miou-ootori,306.0,
15038,15040,Yui KOUNAGI,Unknown,Female,Black,7.698,23.788,Unknown,Unknown,Unknown,"High School Students, Ponytail, Shared Body, Teenagers",292,14,Unknown,https://www.anime-planet.com/characters/yui-kounagi,306.0,
21682,21684,Reisys VI Felicity SUMERAGI,Unknown,Female,Blonde,7.881,17.848,Unknown,Unknown,Unknown,"Immortal, Gothic Lolita, Heterochromia, Pigtails, Vampires",284,22,Unknown,https://www.anime-planet.com/characters/reisys-vi-felicity-sumeragi,306.0,
27917,27919,Peeply Lulu,Unknown,Male,Black,9.858,5.612,Unknown,January 2,Unknown,"Adults, Facial Hair, Hair Antenna, Sunglasses, Tattoos",214,92,Lulu is one of the foremen at Galley-La who is particularly strong and loyal to Iceburg . He has bizarre hair that tends to pop out all over his head – and occasionally body – whenever he smoothes it down.,https://www.anime-planet.com/characters/peeply-lulu,306.0,21.0
26318,26320,Kate SHADOW,Unknown,Female,Black,7.459,75.915,Unknown,Unknown,Unknown,"Pigtails, Children, Wealthy",304,2,Unknown,https://www.anime-planet.com/characters/kate-shadow,306.0,43439.0
10183,10184,Elf,Unknown,Male,Blonde,25.796,1.938,Unknown,Unknown,Unknown,"Pointy Ears, Sharp Teeth",52,254,Unknown,https://www.anime-planet.com/characters/elf-nanbaka,306.0,30016.0
11604,11606,Gates,Unknown,Male,Blonde,20.185,2.152,Unknown,Unknown,Unknown,"Sadistic, Mecha Pilots, Adults, Balding",77,229,Unknown,https://www.anime-planet.com/characters/gates,306.0,73.0
17565,17567,Mr. Oga,Unknown,Male,Black,8.583,9.281,Unknown,Unknown,Unknown,"Adults, Glasses",254,52,Unknown,https://www.anime-planet.com/characters/mr-oga,306.0,9513.0
1522,1522,Mishio AMANO,Unknown,Female,Brown,7.918,16.508,Purple,December 6,A,"High School Students, Teenagers",282,24,Unknown,https://www.anime-planet.com/characters/mishio-amano,306.0,144.0
9455,9456,Christie,70394,Male,Blue,7.887,18.098,Blue,"May 15, 2040",Unknown,"Children, Orphans, Tattoos",284,22,Unknown,https://www.anime-planet.com/characters/christie,306.0,
41878,41882,Taek JEGAL,Unknown,Male,Blue,19.076,2.247,Unknown,Unknown,Unknown,"Superpowers, Martial Artists, Hair Antenna, Teenagers, Ruthless",85,221,Unknown,https://www.anime-planet.com/characters/taek-jegal,306.0,41353.0
2365,2365,Taeko MINAZUKI,Unknown,Female,Red,8.278,11.388,Unknown,Unknown,Unknown,"Glasses, Clumsy, Maids",266,40,Unknown,https://www.anime-planet.com/characters/taeko-minazuki,306.0,53.0
37320,37322,Jail MURDOCH,Iron Jail,Male,Grey,7.818,20.066,Unknown,Unknown,Unknown,"Glasses, Gloves, Military, Superpowers",287,19,Unknown,https://www.anime-planet.com/characters/jail-murdoch,306.0,37345.0
9265,9266,Kyros,Unknown,Male,Black,7.836,19.189,Unknown,September 22,Unknown,"Adults, Capes, Facial Hair, Muscular, No Eyebrows, Scars, Sword Fighters, Warriors",286,20,Unknown,https://www.anime-planet.com/characters/kyros,306.0,21.0
8037,8038,Rebecca RANDALL,Unknown,Female,Orange,7.61,29.825,Unknown,Unknown,Unknown,"High School Students, Student Council, Teenagers",296,10,Unknown,https://www.anime-planet.com/characters/rebecca-randall,306.0,
3847,3847,Hilda,Hot Ice,Female,Black,7.775,20.2,Unknown,Unknown,Unknown,"Artificial Limbs, Eye Patches, Adults, Blinding Bangs",288,18,Unknown,https://www.anime-planet.com/characters/hilda,306.0,
31609,31611,Ninjin,Carrot,Male,Purple,11.038,4.259,Unknown,February 2,Unknown,"Blinding Bangs, Children, Hats, Unconventional Weapon",185,121,"Ninjin is one third of Usopp ’s pirate crew in Syrup Village whose weapon of choice is a frying pan. When he grows up, he hopes to run his own tavern.",https://www.anime-planet.com/characters/ninjin,306.0,21.0
447,447,Natsumi HINATA,Unknown,Female,Pink,8.39,10.551,Unknown,Unknown,Unknown,"Middle School Students, Pigtails, Teenagers",261,44,"Natsumi is Fuyuki ’s older sister. Unlike her brother, she has little patience when it comes to Keroro and frequently shouts at him for his latest crazy scheme or for simply skipping his chores. She is very strong and can hold her own in a fight, something that has managed to capture Giroro ’s eye. Though Natsumi is generally very level headed she has a crush on Saburo , which turns her into a giddy schoolgirl.",https://www.anime-planet.com/characters/natsumi-hinata,305.0,21671.0
22571,22573,Nako SUNAO,Unknown,Female,Blonde,7.493,60.604,Unknown,Unknown,Unknown,"Teenagers, Middle School Students, Moles",302,3,Unknown,https://www.anime-planet.com/characters/nako-sunao,305.0,
6711,6712,Nanjirou ECHIZEN,Unknown,Male,Brown,7.691,24.768,Unknown,Unknown,Unknown,"Adults, Athletes, Perverted, Tennis Players",292,13,"Nanjirou is Ryouma's father who was previously nicknamed ""Samurai"" during his glory days as a tennis pro. He is a carefree man who spends his time lounging around the house and sneaking looks at magazines filled with scantily-clad women.",https://www.anime-planet.com/characters/nanjirou-echizen,305.0,
9278,9279,Kinemon,Foxfire Kinemon,Male,Black,8.15,13.382,Unknown,January 29,Unknown,"Adults, Facial Hair, Feudal Retainers, Perverted, Samurai, Superpowers, Sword Fighters, Tattoos, Topknot, Verbal Tic",272,33,Unknown,https://www.anime-planet.com/characters/kinemon,305.0,21.0
10689,10691,Fanzell KRUGER,Unknown,Male,Red,7.619,32.368,Unknown,Unknown,Unknown,"Adults, Elemental Powers, Facial Hair, Frequently-Naked, Magic Users, Military Veterans, Scars, Sword Fighters, Wind Powers",296,9,Unknown,https://www.anime-planet.com/characters/fanzell-kruger,305.0,34572.0
13148,13150,Honoka SAKURAI,Unknown,Female,Black,8.56,9.578,Unknown,Unknown,Unknown,"High School Students, Teenagers, Shrine Maidens, Team Managers",255,50,Unknown,https://www.anime-planet.com/characters/honoka-sakurai,305.0,390.0
10989,10991,Ai EBIHARA,Unknown,Female,Brown,14.109,2.977,Unknown,Unknown,Unknown,"High School Students, Team Managers, Teenagers",133,172,Unknown,https://www.anime-planet.com/characters/ai-ebihara,305.0,10588.0
7792,7793,Kazuha,Suki,Male,Blonde,7.805,20.483,Unknown,Unknown,Unknown,"Ghosts, Magical Familiars, Shapeshifters",287,18,Unknown,https://www.anime-planet.com/characters/kazuha,305.0,20507.0
1566,1566,Class President,Unknown,Male,Black,61.595,1.614,Unknown,Unknown,Unknown,"Class Representatives, High School Students, Monsters, Teenagers",9,296,Unknown,https://www.anime-planet.com/characters/class-president-rosario-to-vampire,305.0,
27913,27915,Director Heinemann,Unknown,Male,Grey,64.307,1.606,Unknown,Unknown,Unknown,"Doctors, Adults, Wealthy, Glasses",8,297,Unknown,https://www.anime-planet.com/characters/director-heinemann,305.0,19.0
9251,9252,Momonosuke,Unknown,Male,Black,11.247,4.188,Unknown,October 7,Unknown,"Children, Crybabies, Perverted, Samurai, Superpowers, Topknot, Verbal Tic",181,124,Unknown,https://www.anime-planet.com/characters/momonosuke,305.0,21.0
10698,10700,Sumire KAKEI,Unknown,Female,Purple,9.079,7.492,Unknown,Unknown,Unknown,"Pigtails, Ninja, Class Representatives, Children, Braids",238,67,Unknown,https://www.anime-planet.com/characters/sumire-kakei,305.0,34566.0
2110,2110,Satsuki MIYANOSHITA,Unknown,Female,Red,7.74,22.738,Unknown,Unknown,Unknown,"Braids, Ponytail, Hair Ribbons, Elementary School Students, Children, Transfer Students",290,15,Unknown,https://www.anime-planet.com/characters/satsuki-miyanoshita,305.0,
30800,30802,Koneko,Unknown,Female,Orange,8.085,14.291,Unknown,Unknown,Unknown,Glasses,275,30,Unknown,https://www.anime-planet.com/characters/koneko,305.0,23115.0
19866,19868,Kaho HIIRAGI,Unknown,Female,Brown,8.143,13.233,Unknown,Unknown,Unknown,Teenagers,272,33,Unknown,https://www.anime-planet.com/characters/kaho-hiiragi,305.0,9367.0
13877,13879,Yuuka AMINO,Unknown,Female,Blue,13.421,3.153,Unknown,Unknown,Unknown,High School Students,142,163,Unknown,https://www.anime-planet.com/characters/yuuka-amino,305.0,10490.0
41264,41267,Akira OTOISHI,Unknown,Male,Purple,11.521,3.962,Unknown,Unknown,Unknown,"Musicians, Scars, Teenagers, Guitarists",175,130,Unknown,https://www.anime-planet.com/characters/akira-otoishi,305.0,
6892,6893,Keiichirou MIYANOSHITA,Unknown,Male,Grey,8.436,10.222,Unknown,Unknown,Unknown,"Elementary School Students, Crybabies, Children, Transfer Students",259,46,Unknown,https://www.anime-planet.com/characters/keiichirou-miyanoshita,305.0,
17880,17882,Nori SAKURADA,Unknown,Female,Brown,10.128,5.278,Brown,Unknown,Unknown,"Pigtails, Hair Antenna, Glasses, Athletes",207,98,Unknown,https://www.anime-planet.com/characters/nori-sakurada,305.0,64.0
22591,22593,Mi,Unknown,Female,Red,7.6,35.152,Unknown,Unknown,Unknown,"Headbands, Video Gamers, Gloves, Elemental Powers, Fire Powers, Guild Masters, Magic Users",297,8,Unknown,https://www.anime-planet.com/characters/mi-itai-no-wa-iya-nano-de-bougyoryoku-ni-kyokufuri-shitai-to-omoimasu,305.0,
5621,5622,Amane,Unknown,Female,Black,8.243,12.25,Grey,Unknown,Unknown,Unknown,268,37,Unknown,https://www.anime-planet.com/characters/amane,305.0,11061.0
43638,43642,Kanichi KONISHI,Unknown,Male,Brown,8.935,8.003,Black,Unknown,Unknown,"Cooks, High School Students, Facial Hair, Teenagers, Pompadours",243,62,Unknown,https://www.anime-planet.com/characters/kanichi-konishi,305.0,
30038,30040,Kamehime,Unknown,Female,Purple,7.856,19.061,Grey,Unknown,Unknown,Deities,285,20,Unknown,https://www.anime-planet.com/characters/kamehime,305.0,
6668,6669,Mitsuyoshi TADA,Unknown,Male,Black,7.455,98.115,Black,Unknown,Unknown,"High School Students, Orphans, Part Time Employees, Photographers, Teenagers",304,1,Unknown,https://www.anime-planet.com/characters/mitsuyoshi-tada,305.0,
17966,17968,Kouko KAMINAGA,Unknown,Female,Black,9.801,5.807,Unknown,Unknown,Unknown,"Assassins, Class Representatives, Explosives Experts, Glasses, High School Students, Pigtails, Teenagers, Transfer Students",216,89,Unknown,https://www.anime-planet.com/characters/kouko-kaminaga,305.0,
