Unnamed: 0,ID,Name,Alias,Gender,Hair Color,Love Rank,Hate Rank,Eye color,Birthday,Blood Type,Tags,Love Count,Hate Count,Description,url,Counts,MAL_ID
11568,11570,Kuno,Sekirei Number 95,Female,Blonde,10.013,8.074,Unknown,Unknown,Unknown,"Aliens, Crybabies, Genetically Engineered, Shy",210,61,Unknown,https://www.anime-planet.com/characters/kuno,271.0,4063.0
20179,20181,Ronie ARABEL,Unknown,Female,Brown,8.624,20.745,Unknown,Unknown,Unknown,"Nobility, Pigtails, Sword Fighters, Teenagers",253,18,Unknown,https://www.anime-planet.com/characters/ronie-arabel,271.0,36474.0
9848,9849,Akari KOUMOTO,Unknown,Female,Magenta,8.365,34.188,Green,Unknown,Unknown,"Adults, Heavy Drinkers, Hot-Headed, Teachers",263,8,Unknown,https://www.anime-planet.com/characters/akari-koumoto,271.0,
7576,7577,Takuma HIROSE,Unknown,Male,Brown,9.399,10.579,Unknown,Unknown,Unknown,"Blind, Disabled, Middle School Students, Teenagers, Transfer Students, Wealthy",227,44,Unknown,https://www.anime-planet.com/characters/takuma-hirose,271.0,3299.0
14242,14244,Jun FURUYA,Unknown,Male,Green,8.71,18.636,Unknown,Unknown,Unknown,"Class Representatives, High School Students, Teenagers",250,21,Unknown,https://www.anime-planet.com/characters/jun-furuya,271.0,
9900,9901,Kogarashi FUYUZORA,7th Generation Yatahagane,Male,Brown,8.318,41.196,Unknown,Unknown,Unknown,"Cooks, High School Students, Orphans, Teenagers, Poor, Exorcists, Bandages, Part Time Employees, Ponytail, Spirit Seers, Martial Artists",265,6,Unknown,https://www.anime-planet.com/characters/kogarashi-fuyuzora,271.0,
30207,30209,Eriko HIRANO,Ekko,Female,Brown,8.857,15.728,Unknown,Unknown,Unknown,"High School Students, Teenagers",245,26,Unknown,https://www.anime-planet.com/characters/eriko-hirano,271.0,
28807,28809,Stalker Man,Unknown,Male,Brown,45.884,1.947,Unknown,Unknown,Unknown,Perverted,18,253,Unknown,https://www.anime-planet.com/characters/stalker-man,271.0,4224.0
28485,28487,Gold Lion Shiki,Unknown,Male,Blonde,17.535,2.915,Unknown,March 20,Unknown,"Adults, Airheads, Dark-skinned, Facial Hair, Pirates, Ruthless, Smokers, Superpowers",96,175,"As the only man in history to escape from Impel Down, Gold Lion Shiki is a notorious pirate, and one of the few to survive from the time of Gol D. Roger . He harnesses the power of the Fluffy Fluffy fruit, which allows him to control and negate the gravitational pull of any inanimate object he touches. Though Shiki often has a habit of seeming flaky by mistaking objects and people for something else, he is particularly ruthless when it comes to his crewmates, often disposing of them when they disappoint him or simply abandoning them to a storm in order to save himself.",https://www.anime-planet.com/characters/gold-lion-shiki,271.0,21.0
6811,6812,Sayori MIZUSHIMA,Unknown,Female,Green,8.859,15.84,Unknown,Unknown,Unknown,"Glasses, Middle School Students, Pigtails, Rosy Cheeks, Student Council, Teenagers",245,26,Unknown,https://www.anime-planet.com/characters/sayori-mizushima,271.0,16353.0
31402,31404,Shinichi TAMAKI,Unknown,Male,Green,9.454,10.481,Unknown,Unknown,Unknown,"High School Students, Student Council, Superpowers, Teenagers",226,45,Unknown,https://www.anime-planet.com/characters/shinichi-tamaki,271.0,
28228,28230,Carol MASTERSON,Unknown,Female,Blonde,14.509,3.604,Unknown,Unknown,Unknown,"Children, Hot-Headed, Hair Ribbons",128,143,"Carol is a young girl who cares a lot about her father, Daddy Masterson . Despite her prim and cute appearance, she can be quite harsh and even rude at times if people try to get in her way.",https://www.anime-planet.com/characters/carol-masterson,271.0,21.0
12016,12018,Ruka ASATO,Lagoon Dolphin,Female,Brown,8.759,17.257,Unknown,Unknown,Unknown,"Video Gamers, Rosy Cheeks, Middle School Students",248,23,Unknown,https://www.anime-planet.com/characters/ruka-asato,271.0,11759.0
635,635,Love-Pon,Unknown,Female,Black,20.955,2.56,Yellow,Unknown,Unknown,"Ponytail, Teenagers",73,198,Unknown,https://www.anime-planet.com/characters/love-pon,271.0,
18546,18548,Karen JINRYOU,Unknown,Female,Black,8.295,45.103,Unknown,Unknown,Unknown,"Airheads, Hair Antenna, High School Students, Sword Fighters, Teenagers",266,5,Unknown,https://www.anime-planet.com/characters/karen-jinryou,271.0,
9886,9887,Megumi IMAE,Unknown,Female,Black,8.359,33.869,Unknown,Unknown,Unknown,"High School Students, Teenagers",263,8,Unknown,https://www.anime-planet.com/characters/megumi-imae,271.0,
8181,8182,Takeaki KIRIHARA,Unknown,Male,Black,8.833,16.32,Unknown,Unknown,Unknown,"Teenagers, Martial Artists, Magic Users, High School Students",246,25,Unknown,https://www.anime-planet.com/characters/takeaki-kirihara,271.0,
30915,30917,Zion THENARDIER,Unknown,Male,Brown,82.144,1.825,Unknown,Unknown,Unknown,"Sadistic, Royalty, Freckles, Big Ego, Armor, Teenagers",4,267,Unknown,https://www.anime-planet.com/characters/zion-thenardier,271.0,
26704,26706,Rin SAWAMURA,Unknown,Female,Black,12.555,4.462,Unknown,Unknown,Unknown,"Glasses, Heavy Drinkers, Gangsters, Adults",155,116,"As the violent and bold elder sister of Seiji, Rin also comes complete with a drinking problem. During her high school years, she was the leader of a street gang and she passed her fighting style onto Seiji. Dispite her brutal career choice, she still cares very much for her younger brother, although Rin still pokes fun at him any chance she gets.",https://www.anime-planet.com/characters/rin-sawamura,271.0,
17886,17888,Lamies,"Corpse Collector, The Spiral Organ",Male,Grey,8.354,33.504,Unknown,Unknown,Unknown,"Canes, Facial Hair, Gloves, Hats, Magic Users",263,8,Unknown,https://www.anime-planet.com/characters/lamies,271.0,355.0
43411,43415,Germania,Unknown,Male,Blonde,8.788,16.571,Unknown,Unknown,Unknown,"Stoic, Anthropomorphic",247,24,Unknown,https://www.anime-planet.com/characters/germania,271.0,
28865,28867,Eiji KASHII,Ox,Male,Black,8.408,30.307,Unknown,Unknown,Unknown,"Horns, Rapunzel Hair, Sword Fighters",261,10,Unknown,https://www.anime-planet.com/characters/eiji-kashii,271.0,
7083,7084,Janet,Unknown,Female,Pink,9.102,12.973,Unknown,Unknown,Unknown,"Gothic Lolita, Magic Users",237,34,Unknown,https://www.anime-planet.com/characters/janet-the-familiar-of-zero-f,271.0,
8682,8683,Muzan's Daughter,Unknown,Female,Black,9.839,8.798,Brown,Unknown,Unknown,"Pigtails, Hair Ribbons, Braids",215,56,Unknown,https://www.anime-planet.com/characters/muzans-daughter,271.0,
6845,6846,Mayuta,Kukun,Male,Brown,8.714,19.294,Unknown,Unknown,Unknown,"Dreadlocks, Sunglasses, Tattoos",250,20,Unknown,https://www.anime-planet.com/characters/mayuta,270.0,35120.0
15948,15950,Rikiga,Unknown,Male,Brown,11.867,5.085,Unknown,Unknown,Unknown,"Adults, Facial Hair, Piercings, Wealthy",168,102,Unknown,https://www.anime-planet.com/characters/rikiga,270.0,
13135,13137,Yurika FUKAHORI,Unknown,Female,Brown,11.314,5.679,Unknown,Unknown,Unknown,"Artists, High School Students, Teenagers",179,91,Unknown,https://www.anime-planet.com/characters/yurika-fukahori,270.0,
30191,30193,Hiroshi FUKUDA,Unknown,Male,Brown,9.074,13.623,Grey,April 26,A,"Athletes, Basketball Players, High School Students, Teenagers",238,32,Unknown,https://www.anime-planet.com/characters/hiroshi-fukuda,270.0,
21072,21074,Cocona,Pure Blade,Female,Blue,8.452,28.396,Unknown,Unknown,Unknown,"Magical Girl, Rosy Cheeks, Teenagers",259,11,Unknown,https://www.anime-planet.com/characters/cocona,270.0,
12487,12489,Chen Guo,Chasing Haze,Female,Brown,8.938,15.53,Unknown,Unknown,Unknown,"Video Gamers, Ponytail, Hot-Headed, Adults",243,27,Unknown,https://www.anime-planet.com/characters/chen-guo,270.0,33926.0
29711,29713,Glen MACKENZIE,Unknown,Male,White,8.832,16.663,Unknown,Unknown,Unknown,"Elderly, Facial Hair",246,24,Unknown,https://www.anime-planet.com/characters/glen-mackenzie,270.0,10087.0
12914,12916,Michitaka,Unknown,Male,Brown,8.311,44.137,Unknown,Unknown,Unknown,"Person in a Strange World, Facial Hair, Video Gamers, Guild Masters",265,5,Unknown,https://www.anime-planet.com/characters/michitaka,270.0,17265.0
20086,20088,Sandora DORTLAKE,Fire Dragon,Female,Orange,8.403,31.574,Blue,Unknown,Unknown,"Chokers, Elemental Powers, Fire Powers, Headbands, Horns, Pointy Ears, Scantily-clad",261,9,Unknown,https://www.anime-planet.com/characters/sandora-dortlake,270.0,
7523,7524,Kosuke NIWA,Unknown,Male,Black,8.746,17.57,Unknown,Unknown,Unknown,"Clumsy, Adults",248,22,Unknown,https://www.anime-planet.com/characters/kosuke-niwa,270.0,61.0
31421,31423,Tatewaki KUNO,"Blue Thunder of Furinkan High, Tacchi",Male,Brown,12.085,4.907,Unknown,Unknown,Unknown,"Airheads, Barefoot, Big Ego, High School Students, Martial Artists, Teenagers, Wealthy",164,106,Unknown,https://www.anime-planet.com/characters/tatewaki-kuno,270.0,
14366,14368,Amazoness,Unknown,Female,Blonde,12.738,4.389,Unknown,Unknown,Unknown,"Muscular, Abnormally Tall, Crowns",152,118,Unknown,https://www.anime-planet.com/characters/amazoness,270.0,7647.0
6236,6237,Keiichi IKARI,Chief,Male,Black,9.09,13.167,Unknown,Unknown,Unknown,"Adults, Detectives, Facial Hair, Smokers",237,33,Unknown,https://www.anime-planet.com/characters/keiichi-ikari,270.0,
8603,8604,Erecpyle DUKAKIS,Unknown,Male,Grey,8.567,22.977,Unknown,Unknown,Unknown,"Military, Sword Fighters, Wealthy",255,15,Unknown,https://www.anime-planet.com/characters/erecpyle-dukakis,270.0,
6360,6361,Harry MACDOUGALL,Unknown,Male,Turquoise,20.359,2.619,Unknown,Unknown,Unknown,"Teenagers, Mercenaries, Hair Ribbons, Cyborgs",76,194,Unknown,https://www.anime-planet.com/characters/harry-macdougall,270.0,
18551,18553,Haruka SHIGURE,Unknown,Female,Brown,11.812,5.129,Unknown,Unknown,Unknown,"High School Students, Teenagers",169,101,Unknown,https://www.anime-planet.com/characters/haruka-shigure,270.0,
16373,16375,Meo KUSAKABE,Unknown,Female,Brown,8.61,21.059,Unknown,Unknown,Unknown,"Braids, Dark-skinned, Pigtails, Teenagers",253,17,Unknown,https://www.anime-planet.com/characters/meo-kamisama-no-memo-chou,270.0,
22758,22760,Yaya FUSHIGURO,Unknown,Female,Turquoise,8.43,30.293,Unknown,Unknown,Unknown,"Teenagers, Animal Ears, Snaggleteeth, Stoic, Tails, Shapeshifters, Animal Hoods, Spirit Seers",260,10,Unknown,https://www.anime-planet.com/characters/yaya-fushiguro,270.0,
3474,3474,Arbitro,Unknown,Male,Blonde,21.645,2.512,Unknown,Unknown,Unknown,"Masks, Perverted, Adults",69,201,Unknown,https://www.anime-planet.com/characters/arbitro,270.0,8449.0
1948,1948,Chieri SONO,Unknown,Female,Blue,8.988,14.567,Turquoise,Unknown,Unknown,"Idols, Teenagers, Wealthy",241,29,Unknown,https://www.anime-planet.com/characters/chieri-sono,270.0,12149.0
16214,16216,Lion,Unknown,Female,Purple,8.867,16.877,Unknown,Unknown,Unknown,"Teenagers, Animal Hoods",245,24,Unknown,https://www.anime-planet.com/characters/lion-mayoiga,269.0,
25047,25049,Hinata HOSHINO,Unknown,Female,Brown,8.374,41.548,Unknown,Unknown,Unknown,"Children, Elementary School Students, Ponytail, Sister Complex, Snaggleteeth",263,6,Unknown,https://www.anime-planet.com/characters/hinata-hoshino,269.0,
11724,11726,Twinkle Maria MURDOCK,Mama,Female,Brown,36.859,2.026,Unknown,Unknown,Unknown,Adults,27,242,Unknown,https://www.anime-planet.com/characters/twinkle-maria-murdock,269.0,1.0
13155,13157,Ena KOMIYA,Unknown,Female,Brown,8.591,23.341,Unknown,Unknown,Unknown,"High School Students, Photographers, Teenagers",254,15,Unknown,https://www.anime-planet.com/characters/ena-komiya,269.0,35639.0
5672,5673,Leviathan,Unknown,Male,Purple,8.41,35.293,Unknown,Unknown,Unknown,"Headphones, 2-D Lovers, Video Gamers, Tails, Horns, Otaku, Demons",261,8,Unknown,https://www.anime-planet.com/characters/leviathan-obey-me-celestial-ray,269.0,
19763,19765,Yuri TAKANASHI,Unknown,Female,Blue,8.308,48.577,Unknown,Unknown,Unknown,Adults,265,4,Unknown,https://www.anime-planet.com/characters/yuri-takanashi,269.0,
4259,4259,Yun-Fat,Unknown,Male,Black,8.433,29.101,Unknown,Unknown,Unknown,"Dual Wielders, Gunslingers, Robots, Sunglasses",259,10,Unknown,https://www.anime-planet.com/characters/yun-fat,269.0,
30883,30885,Great Demon Lord,Beelzebub III,Male,Green,9.51,10.44,Unknown,Unknown,Unknown,"Demon Kings, Demons, Helmets, Royalty",224,45,Unknown,https://www.anime-planet.com/characters/great-demon-lord,269.0,9513.0
7336,7337,Clay SIZEMORE,Unknown,Male,Blonde,8.825,17.185,Unknown,Unknown,Unknown,Teenagers,246,23,Unknown,https://www.anime-planet.com/characters/clay-sizemore,269.0,
7590,7591,Himeko KATAGIRI,Unknown,Female,Blue,8.814,17.081,Unknown,Unknown,Unknown,"Airheads, Hair Antenna, High School Students, Teenagers, Verbal Tic",246,23,"High on energy but short on brains, Himeko is class 1-C's resident imbecile. Her lazniess, stupidity and fertile imagination mean that she often finds herself on the wrong side of Becky , but this does nothing to diminish her adoration towards the tiny teacher. Himeko also tends to shout ""maho"" at every available occasion - a habit which makes about as much sense as her chaotic trains of thought.",https://www.anime-planet.com/characters/himeko-katagiri,269.0,
22010,22012,Kyouka,Unknown,Female,Green,18.346,2.847,Unknown,Unknown,Unknown,"Sadistic, Demons, Big Ego",90,179,Unknown,https://www.anime-planet.com/characters/kyouka,269.0,
13294,13296,Minori ROKUJO,Unknown,Female,Magenta,8.399,33.512,Unknown,Unknown,Unknown,"Teachers, School Principals, Magic Users, Adults",261,8,Unknown,https://www.anime-planet.com/characters/minori-rokujo,269.0,
22112,22114,Kikyou YOSHIKAWA,Unknown,Female,Blue,8.921,15.713,Unknown,Unknown,Unknown,"Adults, Scientists",243,26,Unknown,https://www.anime-planet.com/characters/kikyou-yoshikawa,269.0,
11587,11589,Fei Wong REED,Unknown,Male,Multicolored,32.118,2.091,Unknown,Unknown,Unknown,"Adults, Facial Hair, Magic Users, Monocles",35,234,Unknown,https://www.anime-planet.com/characters/fei-wong-reed,269.0,
13528,13530,Senjurou RENGOKU,Unknown,Male,Multicolored,8.372,46.222,Unknown,Unknown,Unknown,"Ponytail, Epic Eyebrows, Cooks",263,5,Unknown,https://www.anime-planet.com/characters/senjurou-rengoku,268.0,
8538,8539,Maggie MUI,Unknown,Female,Brown,8.461,28.986,Brown,Unknown,Unknown,"Superpowers, Shy, Bookworms, Adults",258,10,"As the middle Paper Sister, Maggie is fiercely protective of her sisters and looks up to Michelle, the eldest sister. Using her paper power to create ""elemental"" creatures, she fights mainly in a defensive manner. She likes small cozy spaces and so she sleeps in a closet, dreaming about her favorite authors, Ernest Hemingway and Nenene Sumiregawa.",https://www.anime-planet.com/characters/maggie-mui,268.0,
25734,25736,Youka NAZE,Unknown,Female,Blue,8.791,18.344,Unknown,Unknown,Unknown,"Bandages, High School Students, Scientists, Teenagers",247,21,Unknown,https://www.anime-planet.com/characters/youka-naze,268.0,11761.0
5664,5665,Constance RAVEAU,Connie,Female,Brown,8.545,26.742,Unknown,Unknown,Unknown,"Adults, Tattoos",256,12,Unknown,https://www.anime-planet.com/characters/constance-raveau,268.0,25183.0
7259,7260,Haruna NAGASHIMA,Unknown,Female,Brown,8.414,32.944,Unknown,Unknown,Unknown,"Athletes, High School Students, Teenagers, Tomboys",260,8,"Haruna was a talented softball player in middle school, but once she entered high school her goals changed. Now determined to find a boyfriend, she is entirely clueless as to what guys find attractive and completely oblivious to what other people are thinking.",https://www.anime-planet.com/characters/haruna-nagashima,268.0,
13987,13989,Kousuke UTSUMI,Unknown,Male,Black,54.519,1.917,Unknown,Unknown,Unknown,"Glasses, High School Students, Magic Users, Perverted, Photographers",12,256,Unknown,https://www.anime-planet.com/characters/kousuke-utsumi,268.0,1691.0
10413,10414,Meena,Unknown,Female,Black,35.199,2.065,Grey,Unknown,Unknown,"Bindi, Dark-skinned, Foreigners",30,238,Unknown,https://www.anime-planet.com/characters/meena,268.0,
8726,8727,Shin NATSUME,Unknown,Male,White,11.552,5.508,Unknown,Unknown,Unknown,"Bikers, High School Students, Martial Artists, Sister Complex, Student Council, Teenagers",174,94,Unknown,https://www.anime-planet.com/characters/shin-natsume,268.0,
29425,29427,Maiku KAMISHIRO,Mike KAMISHIRO,Male,Purple,9.004,14.808,Unknown,Unknown,Unknown,"Computer Programmers, High School Students, Hot-Headed, Orphans, Part Time Employees, Twins, Teenagers",240,28,Unknown,https://www.anime-planet.com/characters/maiku-kamishiro,268.0,
2973,2973,Tsui-Ling,Unknown,Female,Brown,9.884,8.822,Unknown,Unknown,Unknown,Unknown,213,55,Unknown,https://www.anime-planet.com/characters/tsui-ling,268.0,1691.0
8984,8985,Kazuki SHIKIMORI,Unknown,Male,Brown,9.561,10.195,Unknown,Unknown,Unknown,"Magic Users, Teenagers",222,46,Unknown,https://www.anime-planet.com/characters/kazuki-shikimori,268.0,193.0
16003,16005,Mary SIOUX,Unknown,Female,Brown,17.488,3.01,Unknown,Unknown,Unknown,Unknown,97,171,Unknown,https://www.anime-planet.com/characters/mary-sioux,268.0,
28176,28178,Daisuke MATSUO,Unknown,Male,Black,9.239,12.371,Unknown,Unknown,Unknown,"Glasses, University Students, Adults",232,36,Unknown,https://www.anime-planet.com/characters/daisuke-matsuo,268.0,
13351,13353,Ryuken ISHIMA,Unknown,Female,Brown,9.028,14.43,Unknown,Unknown,Unknown,"High School Students, Teenagers",239,29,Ryuken is a kind third year student who is exceptionally popular amongst the girls to the point where her fan club bombard those close to her with seafood related pranks. Ryuken has a very strong sense of honour often acting more like a samurai or traditional Prince Charming than a high school girl.,https://www.anime-planet.com/characters/ryuken-ishima,268.0,
29503,29505,Zagan,Unknown,Male,White,9.418,11.275,Unknown,Unknown,Unknown,"Pointy Ears, Genies, Muscular",227,41,Unknown,https://www.anime-planet.com/characters/zagan,268.0,14513.0
1585,1585,Yuuta,Unknown,Male,Purple,8.5,27.535,Unknown,Unknown,Unknown,Undead,257,11,Unknown,https://www.anime-planet.com/characters/yuuta-zombie-loan,268.0,2404.0
33372,33374,Nahoya KAWATA,Smiley,Male,Brown,8.281,103.662,Unknown,Unknown,Unknown,"Twins, Delinquents, Bikers",267,1,Unknown,https://www.anime-planet.com/characters/nahoya-kawata,268.0,42249.0
11095,11097,Flynn SCIFO,Unknown,Male,Blonde,8.722,19.483,Unknown,Unknown,Unknown,"Armor, Capes, Knights, Military, Teenagers",249,19,Unknown,https://www.anime-planet.com/characters/flynn-scifo,268.0,38110.0
24563,24565,Ai KITORA,Unknown,Female,Black,9.681,9.794,Unknown,Unknown,Unknown,"Exotic Eyes, Teenagers, Middle School Students, Gunslingers",219,49,Unknown,https://www.anime-planet.com/characters/ai-kitora,268.0,24405.0
12679,12681,Haruo YAGUCHI,Unknown,Male,Black,8.685,21.457,Unknown,Unknown,Unknown,Video Gamers,251,17,Unknown,https://www.anime-planet.com/characters/haruo-yaguchi,268.0,
13024,13026,Kirakisho,Sparkling Snowdrop Crystal,Female,White,10.17,7.925,Yellow,Unknown,Unknown,Eye Patches,206,62,Unknown,https://www.anime-planet.com/characters/kirakishou,268.0,65.0
44786,44790,Kouki AMANOGAWA,Unknown,Male,Brown,26.708,2.262,Blue,Unknown,Unknown,"Person in a Strange World, High School Students, Magic Users, Teenagers, Sword Fighters, Capes, Armor, Elemental Powers, Wind Powers, Light Powers",49,219,Unknown,https://www.anime-planet.com/characters/kouki-amanogawa,268.0,
23848,23850,Shiryuu CHOUUN,Unknown,Female,Grey,8.395,35.388,Unknown,Unknown,Unknown,"Closed Eyes, High School Students, Martial Artists, Sword Fighters, Teenagers",261,7,"Presumed to be the secret weapon of Seito high, Chou-un is a mysterious and very powerful toushi. Easily ranked as an A-class fighter, she weilds a sword to quickly dispatch of her enemies. Protecting Gentoku, Chou-un is actually very laid back, preferring to talk over problems than shedding blood.",https://www.anime-planet.com/characters/shiryuu-chouun,268.0,1956.0
11770,11772,Heinkel WOLFE,Unknown,Female,Blonde,10.513,7.145,Unknown,Unknown,Unknown,"Smokers, Adults",198,70,Unknown,https://www.anime-planet.com/characters/heinkel-wolfe,268.0,777.0
17621,17623,Satou's Aunt,Unknown,Female,Purple,10.902,6.514,Unknown,Unknown,Unknown,"Adults, Analytical, Bandages, Braids, Hair Antenna, Masochistic, Ponytail",189,79,Unknown,https://www.anime-planet.com/characters/satous-aunt,268.0,37517.0
11793,11795,Chiho HIDAKA,Unknown,Female,Brown,8.851,17.119,Unknown,Unknown,Unknown,Sickly,245,23,Unknown,https://www.anime-planet.com/characters/chiho-hidaka,268.0,4063.0
7613,7614,Colonel Silver,Unknown,Male,Brown,21.811,2.527,Unknown,Unknown,Unknown,"Adults, Military, Scars",68,200,Unknown,https://www.anime-planet.com/characters/colonel-silver,268.0,223.0
27908,27910,Thatch,Unknown,Male,Brown,10.386,7.438,Unknown,March 24,Unknown,"Adults, Facial Hair, Pirates, Pompadours, Sailors, Scars",201,67,"As commander of Whitebeard ’s Fourth Division fleet, Thatch is a powerful pirate. He was one of the first of the crew to befriend Ace when he arrived.",https://www.anime-planet.com/characters/thatch,268.0,21.0
14107,14109,Albert ENDE,Unknown,Male,White,9.647,10.099,Yellow,Unknown,Unknown,"Tattoos, Piercings, Muscular, Facial Hair, Dark-skinned",220,47,Unknown,https://www.anime-planet.com/characters/albert-ende,267.0,
23230,23232,Fuyumi MIZUHARA,Unknown,Female,Blue,8.572,26.684,Red,Unknown,Unknown,"Cooks, Adults",255,12,Unknown,https://www.anime-planet.com/characters/fuyumi-mizuhara,267.0,
31913,31915,Kuraudo KURASHIKI,"Ace of Tonrou, Sword Eater, Sword Killer",Male,Brown,10.663,7.025,Unknown,Unknown,Unknown,"Tattoos, Delinquents, Magic Users, Sharp Teeth, Sunglasses, Sword Fighters, Teenagers, Bloodthirsty",195,72,Unknown,https://www.anime-planet.com/characters/kuraudo-kurashiki,267.0,
20215,20217,Mizuha KIRYU,Unknown,Female,Brown,8.656,23.463,Unknown,March 3,Unknown,"Cooks, High School Students, Teenagers",252,15,Unknown,https://www.anime-planet.com/characters/mizuha-kiryu,267.0,
32319,32321,Dyne WOODWONDER,Unknown,Male,Green,10.34,7.785,Unknown,Unknown,Unknown,"Circlets, Closed Eyes, Facial Hair, Magic Users",203,64,Unknown,https://www.anime-planet.com/characters/dyne-woodwonder,267.0,29803.0
23932,23934,Nao KADENA,Unknown,Female,Black,9.007,15.242,Unknown,Unknown,Unknown,"Flirts, Mischievous, Racers, Scantily-clad",240,27,Unknown,https://www.anime-planet.com/characters/nao-kadena,267.0,245.0
36168,36170,Knuckle,Unknown,Male,Black,9.065,14.475,Unknown,Unknown,Unknown,"Bandages, Boxers, Ghosts, Athletes",238,29,Unknown,https://www.anime-planet.com/characters/knuckle,267.0,
10360,10361,Doppo KANNONZAKA,"DOPPO, Doppomine",Male,Multicolored,8.344,63.009,Green,May 15,A,"Salaryman, Hair Antenna, Eye Bags, Adults",264,3,Unknown,https://www.anime-planet.com/characters/doppo-kannonzaka,267.0,40803.0
33017,33019,Mantle,Unknown,Male,Black,46.219,1.979,Black,Unknown,AB,"Buzz Cut, Facial Hair, Small Stature",18,249,Unknown,https://www.anime-planet.com/characters/mantle-dr-stone,267.0,38691.0
18074,18076,Hinako KUJOU,Hina,Female,Red,8.796,19.064,Unknown,Unknown,Unknown,"Gloves, Glasses, Kansai Dialect, Ponytail, Scantily-clad, Teenagers, Dancers, Summoners",247,20,Unknown,https://www.anime-planet.com/characters/hinako-kujou,267.0,16512.0
21234,21236,Miraku-run,"Kurumi, Majokko Mirakurun, Witch Girl Mirakurun",Female,Pink,9.016,15.347,Unknown,Unknown,Unknown,"Hats, Magical Girl, Pigtails, Rosy Cheeks",240,27,Unknown,https://www.anime-planet.com/characters/miraku-run,267.0,10495.0
24055,24057,Ayesha IGNIS FATUUS,Unknown,Female,Blue,10.287,7.882,Unknown,Unknown,Unknown,"Gothic Lolita, Hats, Magic Users, Pigtails, Pointy Ears",204,63,Unknown,https://www.anime-planet.com/characters/ayesha-ignis-fatuus,267.0,
17601,17603,Fumiya KURIMOTO,Unknown,Male,Brown,8.772,19.955,Unknown,Unknown,Unknown,"Glasses, Part Time Employees",248,19,Unknown,https://www.anime-planet.com/characters/fumiya-kurimoto,267.0,
2247,2247,Runo MISAKI,Unknown,Female,Turquoise,9.232,12.613,Unknown,Unknown,Unknown,"Battle Gamers, Hair Antenna, Pigtails, Tomboys",232,35,"Partner to the earth based Haos Tigrerra, Runo hates the fact that people assume she is not a worthy opponent because she is a girl. Trying her hardest to prove them wrong, she is a headstrong and outgoing tomboy. Working hard in her family's restaurant, she becomes more than a little jealous of the male attention lavished on her friend, Alice.",https://www.anime-planet.com/characters/runo-misaki,267.0,2156.0
3836,3836,Ryuho,Master of Zetsuei,Male,Green,9.692,9.705,Red,Unknown,Unknown,"Superpowers, Teenagers, Wealthy",218,49,"Ryuho is a top ranked HOLY agent whose desire to avenge his mother's death initially led him to join the force. He has an obsession with extinguishing all the Natives from the Lost Ground, something that frequently leads to clashes with his rival, Kazuma. The title ‘Master of Zetsuei’ arose from perfecting his innovative Alter power: an independent humanoid puppet. Ryuho's assigned partner is Scheris, but due to the young man's lack of need for human companionship, her affections for him are left unnoticed.",https://www.anime-planet.com/characters/ryuho,267.0,
6058,6059,Angela CARPENTER,Unknown,Female,Black,9.321,12.314,Unknown,Unknown,Unknown,"Actors, Bossy, Chokers, Dark-skinned, Models, Singers, Teenagers",230,37,Unknown,https://www.anime-planet.com/characters/angela-carpenter,267.0,37435.0
15096,15098,Gramps,Unknown,Male,Grey,9.216,13.001,Unknown,Unknown,Unknown,"Elderly, Facial Hair, Smokers, Balding",233,34,Unknown,https://www.anime-planet.com/characters/gramps-death-billiards,267.0,14353.0
4025,4025,Prince Dimande,Prince Diamond,Male,White,10.669,6.898,Unknown,Unknown,Unknown,"Aliens, Capes, Magic Users, Piercings, Royalty, Time Travelers, Vengeful",194,73,Unknown,https://www.anime-planet.com/characters/prince-dimande,267.0,
31224,31226,Adam TAYLOR,Unknown,Male,Grey,8.378,53.326,Red,Unknown,Unknown,"Knights, Sword Fighters",263,4,Unknown,https://www.anime-planet.com/characters/adam-taylor,267.0,
30390,30392,Albert DE MORCERF,Unknown,Male,Brown,10.831,6.613,Unknown,Unknown,Unknown,"Teenagers, Wealthy",190,77,Unknown,https://www.anime-planet.com/characters/albert-de-morcerf,267.0,
