Unnamed: 0,ID,Name,Alias,Gender,Hair Color,Love Rank,Hate Rank,Eye color,Birthday,Blood Type,Tags,Love Count,Hate Count,Description,url,Counts,MAL_ID
29933,29935,Akira TAKAYANAGI,Unknown,Male,Black,18.468,5.006,Unknown,Unknown,Unknown,"Glasses, Teachers",89,104,Unknown,https://www.anime-planet.com/characters/akira-takayanagi,193.0,
10945,10947,Kagari SHIINA,Kana,Female,Red,12.588,12.046,Blue,"July 7, 2026",A,Orphans,155,38,Unknown,https://www.anime-planet.com/characters/kagari-shiina,193.0,30484.0
27211,27213,Salvatore DONI,Unknown,Male,Blonde,13.431,9.457,Unknown,Unknown,Unknown,"Adults, Magic Users, Sunglasses",142,51,Unknown,https://www.anime-planet.com/characters/salvatore-doni,193.0,
34674,34676,Shuichi TSUKAMOTO,Unknown,Male,Brown,11.88,16.347,Unknown,Unknown,Unknown,"Band Members, High School Students, Musicians, Teenagers",168,25,Unknown,https://www.anime-planet.com/characters/shuichi-tsukamoto,193.0,35082.0
8800,8801,Noel,Unknown,Female,Blue,11.037,32.909,Unknown,Unknown,Unknown,"Magical Girl, Mermaids, Singers",185,8,Unknown,https://www.anime-planet.com/characters/noel,193.0,1110.0
16763,16765,Mino,Unknown,Female,Black,12.405,12.715,Unknown,Unknown,Unknown,"High School Students, Teenagers",158,35,Unknown,https://www.anime-planet.com/characters/mino-daily-lives-of-high-school-boys,193.0,
5218,5218,Jeanne d'Arc,Joan of Arc,Female,Blonde,11.421,22.113,Unknown,Unknown,Unknown,"Knights, Historical Figures, Anthropomorphic",177,16,Unknown,https://www.anime-planet.com/characters/jeanne-darc-hetalia-axis-powers,193.0,15195.0
30613,30615,Minchey,Unknown,Male,Red,46.683,2.906,Unknown,Unknown,Unknown,"Adults, Hats, Military, Sailors",17,176,"Subordinate of Captain Moor , Minchey is a Chief Petty Officer in the marines, but despite his lower rank, he doesn’t always listen to his superiors if the situation won’t benefit him.",https://www.anime-planet.com/characters/minchey,193.0,21.0
17812,17814,Precia TESTAROSSA,Unknown,Female,Grey,43.183,2.95,Unknown,Unknown,Unknown,"Adults, Capes, Chokers, Circlets, Elemental Powers, Lightning Powers, Magic Users, Ruthless, Scientists, Sickly, Single Parents",20,173,Unknown,https://www.anime-planet.com/characters/precia-testarossa,193.0,
12418,12420,Hisahito MIZUKI,Unknown,Male,Black,10.804,72.499,Unknown,Unknown,Unknown,"Athletes, Soccer Players, High School Students, Teenagers, Team Captains",191,2,Unknown,https://www.anime-planet.com/characters/hisahito-mizuki,193.0,24823.0
28444,28446,Porchemy,Unknown,Male,Blue,48.192,2.889,Unknown,April 3,Unknown,"Abnormally Tall, Adults, Piercings, Pirates, Tattoos",16,177,"Porchemy is one of the Bluejam Pirates. He is a cruel man who thinks nothing of using excessive force to get the answers he wants, even if it means harming a child.",https://www.anime-planet.com/characters/porchemy,193.0,21.0
36089,36091,Akira SENGOKU,Unknown,Male,Black,10.835,54.405,Unknown,Unknown,Unknown,"Charismatic, High School Students, Teenagers",190,3,Unknown,https://www.anime-planet.com/characters/akira-sengoku,193.0,
17785,17787,Madlax,Unknown,Female,Blonde,11.001,35.477,Unknown,Unknown,Unknown,"Gunslingers, Amnesia, Mercenaries, Teenagers",186,7,"With looks second only to her skill with a gun, Madlax is a beautiful assassin that uses her beauty to infiltrate her targets. Missing memories from over a decade ago, she takes one word that remained with her as a mission code name. Even when deep in war, Madlax can act very girly and seems to be on the hunt for romance to brighten her day.",https://www.anime-planet.com/characters/madlax,193.0,252.0
2043,2043,Chuchu,Unknown,Female,Purple,11.106,31.893,Magenta,June 18,Unknown,"Tails, Singers, Musicians, Guitarists, Band Members, Animal Ears",184,9,Unknown,https://www.anime-planet.com/characters/chuchu-show-by-rock,193.0,27441.0
1564,1564,Bart GARSUS,Unknown,Male,Blonde,14.086,8.177,Unknown,Unknown,Unknown,"Pilots, Teenagers, Hats",133,60,Unknown,https://www.anime-planet.com/characters/bart-garsus,193.0,180.0
30614,30616,Dick,Unknown,Male,Black,46.682,2.905,Unknown,Unknown,Unknown,"Adults, Facial Hair, Thieves, Big Noses",17,176,"Dick is a bandit from East Blue who set out to defeat Zoro in order to avenge his brother, Billy . He believes wholeheartedly that being weak is a sin.",https://www.anime-planet.com/characters/dick,193.0,21.0
1747,1747,Ai,Unknown,Female,Green,11.693,17.561,Unknown,Unknown,Unknown,"Merchants, Airheads, Deadly Chefs, Elemental Powers, Frequently-Naked, Glasses, Magic Users, Nature Powers, Time Travelers, Travelers",171,22,"As the eldest sister in the traveling mansion, Ai is the most mature by a mile tends to act as mother figure to Mai and Mii . Though a bit of a space-case, she does her best to make her family happy, smoothing over Mai and Mii's little life dramas as well as helping the occasional interloper. Her cooking, however, couldn't be described as anything other than a nightmare, so the family leaves all culinary duties to Mea . Ai's power is the ability to 'hear' the voices of plants, which appears to be vital to the journey they are on.",https://www.anime-planet.com/characters/ai-popotan,193.0,610.0
9087,9088,Brother,Unknown,Male,Black,11.07,35.271,Red,Unknown,Unknown,"Children, Hats",185,8,Unknown,https://www.anime-planet.com/characters/brother-akudama-drive,193.0,41433.0
16022,16024,Tatsuha UESUGI,Unknown,Male,Black,11.699,17.603,Unknown,Unknown,Unknown,"Teenagers, Smokers, Monks, Bisexual, Bikers, LGBT+",171,22,"Eiri 's younger brother and a Buddhist priest-in-training who works at his father's temple. Teenage Tatsuha spends more time indulging his adolescent urges and fanboy obsession with singer Ryuuichi Sakuma than seeking enlightenment, however. His voice and face are identical to his brother's, and Tatsuha can easily impersonate him when he wears a blonde wig.",https://www.anime-planet.com/characters/tatsuha-uesugi,193.0,243.0
3908,3908,Lu Guang,Unknown,Male,White,10.778,106.825,Grey,Unknown,Unknown,"Adults, Superpowers",192,1,Unknown,https://www.anime-planet.com/characters/lu-guang,193.0,
44452,44456,Chikubi,Unknown,Unknown,Brown,11.51,20.22,Unknown,Unknown,Unknown,"Animals, Hamsters",175,18,Unknown,https://www.anime-planet.com/characters/chikubi,193.0,7627.0
15173,15175,Takashi SAKUMA,Unknown,Male,Brown,11.805,16.609,Unknown,Unknown,Unknown,"Glasses, High School Students, Part Time Employees, Teenagers",169,24,"Seventeen-year-old Takashi is Kenji's friend, and fellow moderator of OZ. While Kenji is away with Natsuki in the countryside, Takashi continues to monitor OZ and keeps his friend up to date on any new developments.",https://www.anime-planet.com/characters/takashi-sakuma,193.0,5681.0
17568,17570,Hecatos,Unknown,Male,Black,15.209,6.911,Unknown,Unknown,Unknown,Demons,120,73,Unknown,https://www.anime-planet.com/characters/hecatos,193.0,9513.0
6571,6572,Arsene LUPIN,Unknown,Male,Black,10.767,94.351,Unknown,Unknown,Unknown,Thieves,192,1,Unknown,https://www.anime-planet.com/characters/arsene-lupin-code-realize-sousei-no-himegimi,193.0,
27037,27039,Miho NOSAKA,Ribbon,Female,Blue,16.579,5.911,Unknown,Unknown,Unknown,"Hair Ribbons, High School Students, Ponytail, Teenagers",105,87,Unknown,https://www.anime-planet.com/characters/miho-nosaka,192.0,
22408,22410,Unicorn,Unknown,Female,Purple,11.122,35.109,Unknown,Unknown,Unknown,"Anthropomorphic, Hair Ribbons, Ponytail, Shy, Military",184,8,Unknown,https://www.anime-planet.com/characters/unicorn-azur-lane,192.0,38328.0
36393,36395,Sachiko KAWACHI,Unknown,Female,Brown,11.195,29.367,Unknown,Unknown,Unknown,Adults,182,10,Unknown,https://www.anime-planet.com/characters/sachiko-kawachi,192.0,
29035,29037,Nicholas WAYNE,Unknown,Male,Brown,13.331,9.713,Unknown,Unknown,Unknown,"Adults, Information Brokers, Writers",143,49,Unknown,https://www.anime-planet.com/characters/nicholas-wayne,192.0,2251.0
11796,11798,Reina SOHOU,Unknown,Female,Purple,12.22,13.795,Unknown,Unknown,Unknown,"Doctors, Adults",161,31,Unknown,https://www.anime-planet.com/characters/reina-sohou,192.0,935.0
1551,1551,Ran YOO,Unknown,Female,Black,15.786,6.569,Unknown,Unknown,Unknown,"Moles, Blinding Bangs, Sword Fighters",114,78,Unknown,https://www.anime-planet.com/characters/ran-yoo,192.0,22547.0
27626,27628,Suguru AIZAWA,Unknown,Male,Black,11.145,31.36,Unknown,Unknown,Unknown,"Athletes, Soccer Players, Teenagers",183,9,Unknown,https://www.anime-planet.com/characters/suguru-aizawa,192.0,
25897,25899,Reona KISARAGI,Unknown,Female,Purple,13.063,10.724,Purple,Unknown,Unknown,Video Gamers,148,44,Unknown,https://www.anime-planet.com/characters/reona-kisaragi,192.0,
7934,7935,Regulus CORNEAS,Sin Archbishop of Greed,Male,White,20.663,4.458,Yellow,Unknown,Unknown,"Big Ego, Magic Users, Piercings, Sadistic",75,117,Unknown,https://www.anime-planet.com/characters/regulus-corneas,192.0,
24094,24096,Mayura DAIDOUJI,Unknown,Female,Pink,12.609,11.862,Unknown,Unknown,Unknown,"Detectives, Hair Antenna, High School Students, Shrine Maidens, Teenagers",154,38,Unknown,https://www.anime-planet.com/characters/mayura-daidouji,192.0,
17136,17138,Nagasumi's Mother,Unknown,Female,Red,11.603,19.552,Unknown,Unknown,Unknown,Adults,173,19,Unknown,https://www.anime-planet.com/characters/nagasumis-mother,192.0,
23189,23191,Cleveland,Unknown,Female,Orange,10.905,62.665,Unknown,Unknown,Unknown,"Anthropomorphic, Ponytail, Military",189,3,Unknown,https://www.anime-planet.com/characters/cleveland,192.0,38328.0
14548,14550,Reiko KATAKURA,Unknown,Female,Red,11.948,15.664,Unknown,Unknown,Unknown,"Adults, Bossy",166,26,Unknown,https://www.anime-planet.com/characters/reiko-katakura,192.0,
6957,6958,Rayregalia VERS RAYVERS,Emperor of Vers,Male,White,44.672,2.961,Unknown,Unknown,Unknown,"Aliens, Elderly, Royalty",19,173,Unknown,https://www.anime-planet.com/characters/rayregalia-vers-rayvers,192.0,22729.0
5221,5221,Souta MOCHIZUKI,Unknown,Male,Brown,11.03,40.775,Unknown,Unknown,Unknown,"High School Students, Teenagers",186,6,Unknown,https://www.anime-planet.com/characters/souta-mochizuki,192.0,
17544,17546,Ayano IIDA,Unknown,Female,Green,11.566,20.408,Unknown,Unknown,Unknown,"Headbands, Sweet Tooth",174,18,Unknown,https://www.anime-planet.com/characters/ayano-iida,192.0,
37221,37223,Furuichi TERAOKA,Unknown,Male,Black,24.041,3.824,Unknown,Unknown,Unknown,"High School Students, Martial Artists, Teenagers, Glasses",58,134,Unknown,https://www.anime-planet.com/characters/furuichi-teraoka,192.0,
12118,12120,Ryuuhei KASUGA,Unknown,Male,Brown,12.41,13.02,Brown,November 21,O,"Athletes, Basketball Players, High School Students, Teenagers",158,34,Unknown,https://www.anime-planet.com/characters/ryuuhei-kasuga,192.0,
21706,21708,Sendai,"Keijunyoukan Sendai, Sendai Class Light Cruiser",Female,Brown,11.058,36.917,Unknown,Unknown,Unknown,"Pigtails, Military, Anthropomorphic",185,7,Unknown,https://www.anime-planet.com/characters/sendai,192.0,
15717,15719,Baalberith,Unknown,Male,Black,27.27,3.565,Unknown,Unknown,Unknown,"Demons, Facial Hair, Hats, Nobility, Pointy Ears, Scars, Smokers, Tattoos",47,145,Unknown,https://www.anime-planet.com/characters/baalberith,192.0,
28862,28864,Ryoka NIWA,Rooster,Female,Green,13.251,10.147,Unknown,Unknown,Unknown,"Braids, Capes, Scantily-clad, Unconventional Weapon",145,47,Unknown,https://www.anime-planet.com/characters/ryoka-niwa,192.0,
13801,13803,Hwi SEO,Unknown,Male,Red,10.867,78.351,Unknown,Unknown,Unknown,"Adults, LGBT+",190,2,Unknown,https://www.anime-planet.com/characters/hwi-seo,192.0,
3526,3526,Nyantenshi,Unknown,Male,White,11.271,26.322,Unknown,Unknown,Unknown,"Angels, Animals, Wings, Cats",180,12,Unknown,https://www.anime-planet.com/characters/nyantenshi,192.0,10197.0
5320,5320,Jiro JO,Joji,Male,Blonde,11.29,27.135,Unknown,Unknown,Unknown,"Twins, University Students",180,12,Unknown,https://www.anime-planet.com/characters/jiro-jo,192.0,
27851,27853,Kirino AYASEGAWA,Unknown,Female,Brown,21.269,4.278,Unknown,Unknown,Unknown,"Glasses, High School Students, Teenagers",71,121,Unknown,https://www.anime-planet.com/characters/kirino-ayasegawa,192.0,8424.0
33669,33671,Oudo MIYAKONOJOU,Unknown,Male,Blonde,17.024,5.676,Unknown,Unknown,Unknown,"Anti-Gravity Hair, Big Ego, God Complex, High School Students, Piercings, Teenagers, Chokers",101,91,Unknown,https://www.anime-planet.com/characters/oudo-miyakonojou,192.0,11761.0
27846,27848,Wakana NURA,Unknown,Female,Brown,11.082,33.089,Unknown,Unknown,Unknown,Adults,184,8,Unknown,https://www.anime-planet.com/characters/wakana-nura,192.0,
7599,7600,Honoka YUKISHIRO,"Cure White, Hannah WHITEHOUSE",Female,Blue,11.087,33.382,Unknown,Unknown,Unknown,"Scientists, Middle School Students, Magical Girl, Teenagers, School Idols",184,8,Unknown,https://www.anime-planet.com/characters/honoka-yukishiro,192.0,
14939,14941,Ryuuji TOMIOKA,Tomio,Male,Brown,11.965,15.809,Unknown,Unknown,Unknown,"High School Students, Piercings, Teenagers",166,26,Unknown,https://www.anime-planet.com/characters/ryuuji-tomioka,192.0,
12967,12969,Mari TENNOUJI,Unknown,Female,Blonde,12.176,14.164,Unknown,Unknown,Unknown,"Cooks, High School Students, Student Council, Teenagers",162,30,Unknown,https://www.anime-planet.com/characters/mari-tennouji,192.0,
6120,6121,Taketazaki,Unknown,Male,Black,14.865,7.347,Unknown,Unknown,Unknown,"Photographers, Information Brokers",124,68,Unknown,https://www.anime-planet.com/characters/taketazaki-c-the-money-of-soul-and-possibility-control,192.0,10163.0
15885,15887,Yoshitoki WASHUU,Unknown,Male,Black,20.245,4.535,Unknown,Unknown,Unknown,"Adults, Facial Hair",77,115,Unknown,https://www.anime-planet.com/characters/yoshitoki-washuu,192.0,27899.0
5326,5326,Taro JO,Jota,Male,Blonde,11.389,24.505,Unknown,Unknown,Unknown,"Twins, University Students",178,14,Unknown,https://www.anime-planet.com/characters/taro-jo,192.0,
49623,49629,Pete PUMPS,Unknown,Male,Blonde,10.833,64.094,Unknown,Unknown,Unknown,"Ghosts, Pilots, Piercings, Eternal Optimists",190,2,Unknown,https://www.anime-planet.com/characters/pete-pumps,192.0,476.0
9140,9141,Ken AMADA,Unknown,Male,Brown,12.168,14.128,Unknown,Unknown,Unknown,"Children, Middle School Students",162,30,Unknown,https://www.anime-planet.com/characters/ken-amada,192.0,14407.0
19851,19853,Rachel PHANTOMHIVE,Unknown,Female,Blonde,11.72,18.505,Blue,Unknown,Unknown,"Adults, Nobility, Wealthy",171,21,Unknown,https://www.anime-planet.com/characters/rachel-phantomhive,192.0,
19047,19049,Taiki,Kaname TAKASATO,Male,Black,11.591,19.428,Unknown,Unknown,Unknown,"Children, Person in a Strange World",173,19,Unknown,https://www.anime-planet.com/characters/taiki,192.0,
8823,8824,Gakuto,Gackto,Male,Grey,12.79,11.16,Unknown,Unknown,Unknown,Unknown,151,41,Unknown,https://www.anime-planet.com/characters/gakuto,192.0,1110.0
22474,22476,Nozomi GOKURAKU,Unknown,Female,Black,10.859,73.237,Unknown,Unknown,Unknown,"Monsters, High School Students, Tomboys, Athletes, Teenagers, Pointy Ears, Tails, Martial Artists",190,2,Unknown,https://www.anime-planet.com/characters/nozomi-gokuraku,192.0,
24929,24931,Arrester BLANKET,Unknown,Female,Blue,11.405,22.657,Unknown,Unknown,Unknown,"Masochistic, Hot-Headed, Headbands, Glasses",177,15,Unknown,https://www.anime-planet.com/characters/arrester-blanket,192.0,
34149,34151,Footman,Unknown,Male,Green,52.194,2.876,Unknown,Unknown,Unknown,"Masks, Magic Users, Demons",14,178,Unknown,https://www.anime-planet.com/characters/footman,192.0,
14842,14844,Miyabi,Unknown,Male,Black,12.069,15.32,Unknown,Unknown,Unknown,Hair Antenna,164,27,Unknown,https://www.anime-planet.com/characters/miyabi-ore-no-imouto-ga-konna-ni-kawaii-wake-ga-nai,191.0,
28830,28832,Casey,Nanako,Female,Purple,13.66,9.303,Unknown,Unknown,Unknown,"Hats, Monster Tamers, Pigtails, Travelers, Kansai Dialect",139,52,Unknown,https://www.anime-planet.com/characters/casey-pokemon,191.0,527.0
55511,55518,Seiichirou SHINGYOUJI,Unknown,Male,Black,10.87,101.144,Unknown,Unknown,Unknown,"Athletes, University Students, Stoic, Rugby Players",190,1,Unknown,https://www.anime-planet.com/characters/seiichirou-shingyouji,191.0,39583.0
40764,40767,Elise JAMIL,Unknown,Female,Brown,10.911,77.491,Unknown,Unknown,Unknown,"Nobility, Magic Users, Monster Tamers, Adults, Hair Buns, Braids",189,2,Unknown,https://www.anime-planet.com/characters/elise-jamil,191.0,
12631,12633,Hajime AOYAGI,Unknown,Male,Brown,11.106,36.874,Unknown,Unknown,Unknown,"Athletes, Blinding Bangs, Cyclists, High School Students, Racers, Stoic, Teenagers",184,7,Unknown,https://www.anime-planet.com/characters/hajime-aoyagi,191.0,18179.0
12508,12510,Shibo,Cibo,Female,White,10.999,42.345,Unknown,Unknown,Unknown,Scientists,186,5,Unknown,https://www.anime-planet.com/characters/shibo-blame,191.0,
49139,49145,Nagisa ARAGAKI,Unknown,Female,Brown,12.061,15.978,Unknown,Unknown,Unknown,"Hot-Headed, High School Students, Athletes, Teenagers, Moles, Badminton Players",165,26,Unknown,https://www.anime-planet.com/characters/nagisa-aragaki,191.0,37259.0
13422,13424,Fuuma MONOU,Unknown,Male,Black,14.171,8.303,Unknown,Unknown,Unknown,"Athletes, Teenagers",132,59,Unknown,https://www.anime-planet.com/characters/fuuma-monou,191.0,2274.0
16047,16049,Yoming,Unknown,Male,Black,21.491,4.283,Unknown,Unknown,Unknown,Adults,70,121,Unknown,https://www.anime-planet.com/characters/yoming,191.0,
19746,19748,Nayla,53394,Female,Blonde,11.629,20.657,Unknown,Unknown,Unknown,"Orphans, Children, Tattoos",173,18,Unknown,https://www.anime-planet.com/characters/nayla,191.0,
14538,14540,Yuusuke TABATA,Unknown,Male,Brown,11.014,43.416,Unknown,Unknown,Unknown,"Glasses, University Students",186,5,Unknown,https://www.anime-planet.com/characters/yuusuke-tabata,191.0,
28302,28304,Ginkaku UNERI,Unknown,Male,Multicolored,12.284,13.851,Unknown,Unknown,Unknown,"Adults, Hair Antenna, Samurai",160,31,Unknown,https://www.anime-planet.com/characters/ginkaku-uneri,191.0,6594.0
3994,3994,Yamanbagiri Kunihiro,Unknown,Male,Blonde,10.946,60.484,Unknown,Unknown,Unknown,"Capes, Shy, Sword Fighters, Anthropomorphic",188,3,Unknown,https://www.anime-planet.com/characters/yamanbagiri-kunihiro,191.0,33023.0
26997,26999,Yohei YAMADA,Unknown,Male,Brown,11.451,22.623,Unknown,Unknown,Unknown,"Children, Kindergartners, Rosy Cheeks",176,15,Unknown,https://www.anime-planet.com/characters/yohei-yamada,191.0,3841.0
25280,25282,Kirara MIZUTANI,Unknown,Female,Brown,74.187,2.744,Brown,Unknown,Unknown,"Magic Users, Magical Familiars, Person in a Strange World",6,185,Unknown,https://www.anime-planet.com/characters/kirara-mizutani,191.0,
2673,2673,Qi,Unknown,Male,Grey,11.381,25.567,Unknown,Unknown,Unknown,"Adults, Facial Hair, Piercings, Prisoners, Smokers, Sunglasses",178,13,Unknown,https://www.anime-planet.com/characters/qi,191.0,30016.0
27180,27182,Touma AMAKASU,Unknown,Male,Black,14.525,7.873,Unknown,Unknown,Unknown,"Adults, Glasses, Magic Users, Ponytail",128,63,Unknown,https://www.anime-planet.com/characters/touma-amakasu,191.0,
9088,9089,Margaret MITCHELL,Unknown,Female,Brown,17.976,5.324,Unknown,Unknown,Unknown,"Superpowers, Hats, Wind Powers, Elemental Powers",93,98,Unknown,https://www.anime-planet.com/characters/margaret-mitchell,191.0,
8741,8742,Eliza FAUST,Unknown,Female,Blonde,11.761,18.311,Unknown,"June 29, 1963",Unknown,"Ghosts, Headbands, Nurses",170,21,Unknown,https://www.anime-planet.com/characters/eliza-faust,191.0,154.0
32810,32812,Leonardo STOLA,Unknown,Male,Brown,12.417,13.352,Unknown,Unknown,Unknown,"Animal Ears, Tails",158,33,Unknown,https://www.anime-planet.com/characters/leonardo-stola,191.0,
17962,17964,Dist the Reaper,"Dist the Rose, Saphir ORTION NEISS",Male,White,17.764,5.337,Unknown,Unknown,Unknown,"Adults, Big Ego, Glasses, Gloves, Hot-Headed, Inventors, Magic Users, Military, Scientists",94,97,Unknown,https://www.anime-planet.com/characters/saphir-ortion-gneiss,191.0,4884.0
2919,2919,Tetsuki TAKAOKA,Unknown,Male,Black,10.856,95.705,Unknown,Unknown,Unknown,"Delinquents, High School Students, Teenagers",190,1,Unknown,https://www.anime-planet.com/characters/tetsuki-takaoka,191.0,38080.0
40072,40074,Joo-Heon SEO,Unknown,Male,Black,10.959,62.681,Blue,Unknown,Unknown,"Adults, Sword Fighters, Manipulative, Ruthless, Analytical, Vengeful, Time Travelers",188,3,Unknown,https://www.anime-planet.com/characters/joo-heon-seo,191.0,
30664,30666,Whitney,Akane,Female,Pink,13.348,9.921,Unknown,Unknown,Unknown,"Kansai Dialect, Monster Tamers, Pigtails",143,48,Unknown,https://www.anime-planet.com/characters/whitney,191.0,527.0
11254,11256,Shuuji,Unknown,Male,Grey,13.778,8.963,Unknown,Unknown,Unknown,Glasses,137,54,Unknown,https://www.anime-planet.com/characters/shuuji,191.0,
21877,21879,Hana N. FOUNTAINSTAND,Unknown,Female,White,11.104,36.825,Unknown,Unknown,Unknown,"Dancers, Eternal Optimists, Foreigners, Middle School Students, Rosy Cheeks, Snaggleteeth, Teenagers, Transfer Students",184,7,Unknown,https://www.anime-planet.com/characters/hana-n-fountainstand,191.0,21681.0
13214,13216,Himawari SHINOMIYA,Unknown,Female,Brown,11.017,43.829,Unknown,Unknown,Unknown,"Middle School Students, Teenagers, Hikikomori, Computer Programmers, Power Suits",186,5,Unknown,https://www.anime-planet.com/characters/himawari-shinomiya,191.0,14283.0
19549,19551,Ai KUNOGI,Unknown,Female,Brown,12.959,11.077,Unknown,Unknown,Unknown,"Animators, Artists, Hair Antenna, Shy",149,42,Unknown,https://www.anime-planet.com/characters/ai-kunogi,191.0,25835.0
7121,7122,Illustrious,Unknown,Female,White,10.953,62.662,Unknown,Unknown,Unknown,"Anthropomorphic, Chokers, Hair Ribbons, Hats, Moles, Military",188,3,Unknown,https://www.anime-planet.com/characters/illustrious,191.0,38328.0
7191,7192,Misa TAKAYAMA,Unknown,Female,Blue,11.102,36.757,Unknown,Unknown,Unknown,"Person in a Strange World, Video Gamers",184,7,Unknown,https://www.anime-planet.com/characters/misa-takayama,191.0,17265.0
19079,19081,Alice Bivorio BASSKREIGH,Unknown,Female,Orange,25.972,3.677,Unknown,Unknown,Unknown,Glasses,51,140,Unknown,https://www.anime-planet.com/characters/alice-bivorio-basskreigh,191.0,10578.0
7670,7671,Cain WARLOCK,Unknown,Male,Grey,13.217,10.233,Unknown,Unknown,Unknown,"Immortal, Vampires",145,46,Unknown,https://www.anime-planet.com/characters/cain-warlock,191.0,1498.0
30310,30312,Eclipse Cancer,Unknown,Male,Red,15.167,7.205,Unknown,Unknown,Unknown,"Afros, Magical Familiars, Sunglasses, Verbal Tic, Dancers",121,70,Unknown,https://www.anime-planet.com/characters/eclipse-cancer,191.0,
38462,38464,Balladbird LEE,Unknown,Male,Black,23.519,3.911,Unknown,Unknown,Unknown,"Assassins, Big Ego, Adults, Gangsters, Closed Eyes, Ponytail",60,131,"Cunning, deadly, ambitious -- all words that can be used to describe Balladbird Lee, an associate of Harry MacDowell. Using his expert skills, he is a ruthless assassin who conducts espionage jobs for Millenion. Feigning kindness towards those around him, the only characters Lee appears to care for are Harry and Bob Poundmax.",https://www.anime-planet.com/characters/balladbird-lee,191.0,267.0
1791,1791,Mireille,Unknown,Female,Pink,11.743,18.196,Unknown,Unknown,Unknown,"Children, Hats, Magic Users, Treasure Hunters, Video Gamers",170,21,"An excitable Wavemaster, Mireille searches The World obsessively for rare items. To that extent, she even owns a rare item capable of storing items as well as being a hideout. She is ever the optimist and does her best to help out her friends where she can.",https://www.anime-planet.com/characters/mireille,191.0,
24332,24334,Sakura KANOU,Unknown,Female,Pink,11.674,19.798,Unknown,Unknown,Unknown,"High School Students, Student Council, Teenagers",172,19,Unknown,https://www.anime-planet.com/characters/sakura-kanou,191.0,4224.0
7440,7441,J.D.,Unknown,Male,Blonde,11.001,47.442,Unknown,Unknown,Unknown,Cooks,186,4,Unknown,https://www.anime-planet.com/characters/j-d,190.0,3615.0
28470,28472,Mekao,Unknown,Male,Grey,15.127,7.251,Unknown,Unknown,Unknown,"Adults, Goggles, Mechanics",121,69,Makao is a mechanic stationed on the marine base G-8. He is a skilled man who takes great pride in his work.,https://www.anime-planet.com/characters/mekao,190.0,21.0
6071,6072,Ronald MACDOUGALL,Ron,Male,Black,23.56,3.953,Unknown,Unknown,Unknown,"Adults, Mercenaries, Scars, Piercings, Dark-skinned",60,130,Unknown,https://www.anime-planet.com/characters/ronald-macdougall,190.0,
29384,29386,Carmen 99,Carol MENDOSA,Female,Blue,11.084,38.771,Unknown,Unknown,Unknown,"Mercenaries, Adults, Unconventional Weapon",184,6,Unknown,https://www.anime-planet.com/characters/carmen-99,190.0,411.0
12854,12856,Taejin JIN,Unknown,Male,Grey,10.991,60.805,Unknown,Unknown,Unknown,"Facial Hair, Martial Artists, Scars",187,3,Unknown,https://www.anime-planet.com/characters/taejin-jin,190.0,41353.0
17918,17920,Bakery Employee,Unknown,Female,Black,12.349,13.914,Unknown,Unknown,Unknown,"Adults, Headbands",159,31,Unknown,https://www.anime-planet.com/characters/bakery-employee,190.0,226.0
1990,1990,Makoto YOKOMIZO,Unknown,Female,Blue,12.235,14.568,Unknown,Unknown,Unknown,"Ponytail, Teenagers, Cowardly, Idols",161,29,Unknown,https://www.anime-planet.com/characters/makoto-yokomizo,190.0,12149.0
29376,29378,Biagio BUSONI,Unknown,Male,Blonde,51.088,2.908,Unknown,Unknown,Unknown,"Priests, Magic Users, Hats, Adults, Gravity Manipulators",14,176,Unknown,https://www.anime-planet.com/characters/biagio-busoni,190.0,
24385,24387,Mutsuki,Kuchikukan MUTSUKI,Female,Multicolored,11.826,18.512,Unknown,Unknown,Unknown,"Military, Anthropomorphic",169,21,Unknown,https://www.anime-planet.com/characters/mutsuki,190.0,
18215,18217,Sophie,Unknown,Female,Brown,11.309,27.689,Unknown,Unknown,Unknown,"Adults, Freckles, Ponytail, Waiters",179,11,Unknown,https://www.anime-planet.com/characters/sophie-gosick,190.0,8425.0
39987,39989,Leonardo LIPPI,Unknown,Male,Black,12.674,12.134,Unknown,Unknown,Unknown,Teenagers,153,37,Unknown,https://www.anime-planet.com/characters/leonardo-lippi,190.0,
